{
  "manifestVersion": "0.1.0",
  "projectId": "project_golden_living_001",
  "sceneId": "scene_golden_living_001",
  "revisionId": "rev_golden_0004",
  "coordinateSystem": {
    "linearUnit": "mm",
    "angularUnit": "degree",
    "upAxis": "Z",
    "handedness": "right"
  },
  "nodes": [
    {
      "logicalId": "asset_living_coffee_table_main",
      "nodeName": "AVZ_asset_living_coffee_table_main",
      "type": "proxy_asset",
      "assetDefinitionId": "assetdef_coffee_table_proxy_standard_v1",
      "transform": {
        "position": [3250, 2200, 0],
        "rotationEuler": [0, 0, 0],
        "scale": [1, 1, 1]
      },
      "dimensions": [1200, 650, 380],
      "embeddedMetadata": {
        "AIArchViz.LogicalObjectId": "asset_living_coffee_table_main",
        "AIArchViz.ProjectId": "project_golden_living_001",
        "AIArchViz.SceneId": "scene_golden_living_001",
        "AIArchViz.RevisionId": "rev_golden_0004",
        "AIArchViz.AssetDefinitionId": "assetdef_coffee_table_proxy_standard_v1"
      }
    },
    {
      "logicalId": "asset_living_sofa_main",
      "nodeName": "AVZ_asset_living_sofa_main",
      "type": "proxy_asset",
      "assetDefinitionId": "assetdef_sofa_proxy_standard_v1",
      "materialId": "material_sofa_proxy",
      "materialBaseColorRgb": [0.7215686274509804, 0.6196078431372549, 0.5019607843137255],
      "transform": {
        "position": [3000, 3350, 0],
        "rotationEuler": [0, 0, 180],
        "scale": [1, 1, 1]
      },
      "dimensions": [2400, 950, 780],
      "embeddedMetadata": {
        "AIArchViz.LogicalObjectId": "asset_living_sofa_main",
        "AIArchViz.ProjectId": "project_golden_living_001",
        "AIArchViz.SceneId": "scene_golden_living_001",
        "AIArchViz.RevisionId": "rev_golden_0004",
        "AIArchViz.AssetDefinitionId": "assetdef_sofa_proxy_standard_v1"
      }
    },
    {
      "logicalId": "asset_living_tv_unit_main",
      "nodeName": "AVZ_asset_living_tv_unit_main",
      "type": "proxy_asset",
      "assetDefinitionId": "assetdef_tv_unit_proxy_standard_v1",
      "transform": {
        "position": [3000, 200, 0],
        "rotationEuler": [0, 0, 0],
        "scale": [1, 1, 1]
      },
      "dimensions": [2400, 400, 500],
      "hostGeometryId": "wall_south",
      "embeddedMetadata": {
        "AIArchViz.LogicalObjectId": "asset_living_tv_unit_main",
        "AIArchViz.ProjectId": "project_golden_living_001",
        "AIArchViz.SceneId": "scene_golden_living_001",
        "AIArchViz.RevisionId": "rev_golden_0004",
        "AIArchViz.AssetDefinitionId": "assetdef_tv_unit_proxy_standard_v1"
      }
    },
    {
      "logicalId": "opening_d01",
      "nodeName": "AVZ_opening_d01",
      "type": "door_opening",
      "transform": {
        "position": [2400, 0, 0],
        "rotationEuler": [0, 0, 0],
        "scale": [1, 1, 1]
      },
      "dimensions": [900, 150, 2100],
      "hostGeometryId": "wall_west",
      "offset": 2400,
      "sill": 0,
      "embeddedMetadata": {
        "AIArchViz.LogicalObjectId": "opening_d01",
        "AIArchViz.ProjectId": "project_golden_living_001",
        "AIArchViz.SceneId": "scene_golden_living_001",
        "AIArchViz.RevisionId": "rev_golden_0004"
      }
    },
    {
      "logicalId": "opening_w01",
      "nodeName": "AVZ_opening_w01",
      "type": "window_opening",
      "transform": {
        "position": [1800, 0, 900],
        "rotationEuler": [0, 0, 0],
        "scale": [1, 1, 1]
      },
      "dimensions": [2400, 150, 1500],
      "hostGeometryId": "wall_north",
      "offset": 1800,
      "sill": 900,
      "embeddedMetadata": {
        "AIArchViz.LogicalObjectId": "opening_w01",
        "AIArchViz.ProjectId": "project_golden_living_001",
        "AIArchViz.SceneId": "scene_golden_living_001",
        "AIArchViz.RevisionId": "rev_golden_0004"
      }
    },
    {
      "logicalId": "surface_ceiling_main",
      "nodeName": "AVZ_surface_ceiling_main",
      "type": "ceiling",
      "transform": {
        "position": [0, 0, 3000],
        "rotationEuler": [0, 0, 0],
        "scale": [1, 1, 1]
      },
      "dimensions": [6000, 4500, 0],
      "embeddedMetadata": {
        "AIArchViz.LogicalObjectId": "surface_ceiling_main",
        "AIArchViz.ProjectId": "project_golden_living_001",
        "AIArchViz.SceneId": "scene_golden_living_001",
        "AIArchViz.RevisionId": "rev_golden_0004"
      }
    },
    {
      "logicalId": "surface_floor_main",
      "nodeName": "AVZ_surface_floor_main",
      "type": "floor",
      "materialId": "material_floor_neutral",
      "materialBaseColorRgb": [0.6588235294117647, 0.6392156862745098, 0.6],
      "transform": {
        "position": [0, 0, 0],
        "rotationEuler": [0, 0, 0],
        "scale": [1, 1, 1]
      },
      "dimensions": [6000, 4500, 0],
      "embeddedMetadata": {
        "AIArchViz.LogicalObjectId": "surface_floor_main",
        "AIArchViz.ProjectId": "project_golden_living_001",
        "AIArchViz.SceneId": "scene_golden_living_001",
        "AIArchViz.RevisionId": "rev_golden_0004"
      }
    },
    {
      "logicalId": "wall_east",
      "nodeName": "AVZ_wall_east",
      "type": "wall",
      "materialId": "material_wall_neutral",
      "materialBaseColorRgb": [0.7803921568627451, 0.7411764705882353, 0.6784313725490196],
      "transform": {
        "position": [0, 0, 0],
        "rotationEuler": [0, 0, 0],
        "scale": [1, 1, 1]
      },
      "dimensions": [4500, 150, 3000],
      "start": [6000, 0, 0],
      "end": [6000, 4500, 0],
      "embeddedMetadata": {
        "AIArchViz.LogicalObjectId": "wall_east",
        "AIArchViz.ProjectId": "project_golden_living_001",
        "AIArchViz.SceneId": "scene_golden_living_001",
        "AIArchViz.RevisionId": "rev_golden_0004"
      }
    },
    {
      "logicalId": "wall_north",
      "nodeName": "AVZ_wall_north",
      "type": "wall",
      "materialId": "material_wall_neutral",
      "materialBaseColorRgb": [0.7803921568627451, 0.7411764705882353, 0.6784313725490196],
      "transform": {
        "position": [0, 0, 0],
        "rotationEuler": [0, 0, 0],
        "scale": [1, 1, 1]
      },
      "dimensions": [6000, 150, 3000],
      "start": [6000, 4500, 0],
      "end": [0, 4500, 0],
      "embeddedMetadata": {
        "AIArchViz.LogicalObjectId": "wall_north",
        "AIArchViz.ProjectId": "project_golden_living_001",
        "AIArchViz.SceneId": "scene_golden_living_001",
        "AIArchViz.RevisionId": "rev_golden_0004"
      }
    },
    {
      "logicalId": "wall_south",
      "nodeName": "AVZ_wall_south",
      "type": "wall",
      "materialId": "material_floor_neutral",
      "materialBaseColorRgb": [0.6588235294117647, 0.6392156862745098, 0.6],
      "transform": {
        "position": [0, 0, 0],
        "rotationEuler": [0, 0, 0],
        "scale": [1, 1, 1]
      },
      "dimensions": [6000, 150, 3000],
      "start": [0, 0, 0],
      "end": [6000, 0, 0],
      "embeddedMetadata": {
        "AIArchViz.LogicalObjectId": "wall_south",
        "AIArchViz.ProjectId": "project_golden_living_001",
        "AIArchViz.SceneId": "scene_golden_living_001",
        "AIArchViz.RevisionId": "rev_golden_0004"
      }
    },
    {
      "logicalId": "wall_west",
      "nodeName": "AVZ_wall_west",
      "type": "wall",
      "materialId": "material_wall_neutral",
      "materialBaseColorRgb": [0.7803921568627451, 0.7411764705882353, 0.6784313725490196],
      "transform": {
        "position": [0, 0, 0],
        "rotationEuler": [0, 0, 0],
        "scale": [1, 1, 1]
      },
      "dimensions": [4500, 150, 3000],
      "start": [0, 4500, 0],
      "end": [0, 0, 0],
      "embeddedMetadata": {
        "AIArchViz.LogicalObjectId": "wall_west",
        "AIArchViz.ProjectId": "project_golden_living_001",
        "AIArchViz.SceneId": "scene_golden_living_001",
        "AIArchViz.RevisionId": "rev_golden_0004"
      }
    }
  ],
  "cameras": [
    {
      "logicalId": "camera_living_a",
      "nodeName": "AVZ_camera_living_a",
      "transform": {
        "position": [1200, 3800, 1500],
        "rotationEuler": [-2.84471, 0, 206.565051],
        "scale": [1, 1, 1]
      },
      "target": [3000, 200, 1300],
      "focalLengthMm": 24,
      "sensorWidthMm": 36,
      "embeddedMetadata": {
        "AIArchViz.LogicalObjectId": "camera_living_a",
        "AIArchViz.ProjectId": "project_golden_living_001",
        "AIArchViz.SceneId": "scene_golden_living_001",
        "AIArchViz.RevisionId": "rev_golden_0004"
      }
    },
    {
      "logicalId": "camera_living_b",
      "nodeName": "AVZ_camera_living_b",
      "transform": {
        "position": [5000, 800, 1500],
        "rotationEuler": [-3.76233, 0, 43.66778],
        "scale": [1, 1, 1]
      },
      "target": [2900, 3000, 1300],
      "focalLengthMm": 24,
      "sensorWidthMm": 36,
      "embeddedMetadata": {
        "AIArchViz.LogicalObjectId": "camera_living_b",
        "AIArchViz.ProjectId": "project_golden_living_001",
        "AIArchViz.SceneId": "scene_golden_living_001",
        "AIArchViz.RevisionId": "rev_golden_0004"
      }
    },
    {
      "logicalId": "camera_living_c",
      "nodeName": "AVZ_camera_living_c",
      "transform": {
        "position": [3000, 3950, 1500],
        "rotationEuler": [-3.878525, 0, 180],
        "scale": [1, 1, 1]
      },
      "target": [3000, 1000, 1300],
      "focalLengthMm": 28,
      "sensorWidthMm": 36,
      "embeddedMetadata": {
        "AIArchViz.LogicalObjectId": "camera_living_c",
        "AIArchViz.ProjectId": "project_golden_living_001",
        "AIArchViz.SceneId": "scene_golden_living_001",
        "AIArchViz.RevisionId": "rev_golden_0004"
      }
    }
  ]
}
